{
  "schema_version": "1.0",
  "graph_id": "ps61-skill-knowledge-graph",
  "title": "PS-61 Skill Knowledge Graph",
  "nodes": [
    {"id":"python","label":"Python","category":"language","aliases":["py","python3"],"description":"General-purpose language used for APIs, automation, data and AI.","position":{"x":0.20,"y":0.30}},
    {"id":"flask","label":"Flask","category":"framework","aliases":["flask framework"],"description":"Lightweight Python web framework.","position":{"x":0.32,"y":0.25}},
    {"id":"flask_api","label":"Flask API","category":"backend","aliases":["flaskapi","flask api","flask rest api"],"description":"REST API development with Flask.","position":{"x":0.28,"y":0.38}},
    {"id":"fastapi","label":"FastAPI","category":"framework","aliases":["fast api"],"description":"Typed Python framework for web APIs.","position":{"x":0.12,"y":0.42}},
    {"id":"javascript","label":"JavaScript","category":"language","aliases":["js","ecmascript"],"description":"Programming language for browsers and server runtimes.","position":{"x":0.72,"y":0.30}},
    {"id":"nodejs","label":"Node.js","category":"runtime","aliases":["node","node js","nodejs"],"description":"JavaScript runtime used for backend services and tooling.","position":{"x":0.82,"y":0.27}},
    {"id":"typescript","label":"TypeScript","category":"language","aliases":["ts"],"description":"Typed language that compiles to JavaScript.","position":{"x":0.70,"y":0.17}},
    {"id":"express","label":"Express","category":"framework","aliases":["expressjs","express.js"],"description":"Minimal web framework for Node.js.","position":{"x":0.89,"y":0.39}},
    {"id":"react","label":"React","category":"frontend","aliases":["reactjs","react.js"],"description":"Component library for web interfaces.","position":{"x":0.61,"y":0.31}},
    {"id":"html","label":"HTML","category":"frontend","aliases":["html5"],"description":"Semantic structure for web pages.","position":{"x":0.64,"y":0.48}},
    {"id":"css","label":"CSS","category":"frontend","aliases":["css3"],"description":"Presentation and layout language for web pages.","position":{"x":0.76,"y":0.49}},
    {"id":"figma","label":"Figma","category":"design","aliases":[],"description":"Interface design and prototyping tool.","position":{"x":0.57,"y":0.57}},
    {"id":"sql","label":"SQL","category":"database","aliases":["structured query language"],"description":"Language for querying relational databases.","position":{"x":0.36,"y":0.62}},
    {"id":"postgresql","label":"PostgreSQL","category":"database","aliases":["postgres"],"description":"Relational database used by Supabase.","position":{"x":0.45,"y":0.70}},
    {"id":"supabase","label":"Supabase","category":"platform","aliases":["supabase postgres"],"description":"Hosted Postgres, authentication and backend platform.","position":{"x":0.53,"y":0.66}},
    {"id":"docker","label":"Docker","category":"devops","aliases":["containers","containerization"],"description":"Container tooling for reproducible services.","position":{"x":0.28,"y":0.76}},
    {"id":"git","label":"Git","category":"tool","aliases":["version control"],"description":"Distributed source control.","position":{"x":0.72,"y":0.72}},
    {"id":"github","label":"GitHub","category":"platform","aliases":["github actions"],"description":"Code collaboration and automation platform.","position":{"x":0.83,"y":0.69}},
    {"id":"machine_learning","label":"Machine Learning","category":"data","aliases":["ml"],"description":"Models that learn patterns from data.","position":{"x":0.11,"y":0.65}},
    {"id":"rest_api","label":"REST API","category":"backend","aliases":["rest","restful api"],"description":"HTTP resource interface used between frontend and backend.","position":{"x":0.46,"y":0.39}}
  ],
  "edges": [
    {"source":"python","target":"flask","relationship":"framework_for","weight":0.94},
    {"source":"python","target":"flask_api","relationship":"used_for","weight":1.0},
    {"source":"flask","target":"flask_api","relationship":"builds","weight":0.98},
    {"source":"python","target":"fastapi","relationship":"framework_for","weight":0.96},
    {"source":"flask_api","target":"rest_api","relationship":"implements","weight":0.96},
    {"source":"fastapi","target":"rest_api","relationship":"implements","weight":0.96},
    {"source":"javascript","target":"nodejs","relationship":"runtime_for","weight":1.0},
    {"source":"javascript","target":"typescript","relationship":"extended_by","weight":0.96},
    {"source":"javascript","target":"react","relationship":"used_by","weight":0.94},
    {"source":"nodejs","target":"express","relationship":"framework_for","weight":0.98},
    {"source":"express","target":"rest_api","relationship":"implements","weight":0.92},
    {"source":"react","target":"html","relationship":"renders","weight":0.82},
    {"source":"react","target":"css","relationship":"styled_with","weight":0.82},
    {"source":"html","target":"css","relationship":"used_with","weight":0.95},
    {"source":"figma","target":"react","relationship":"designs_for","weight":0.72},
    {"source":"sql","target":"postgresql","relationship":"queries","weight":1.0},
    {"source":"postgresql","target":"supabase","relationship":"powers","weight":0.98},
    {"source":"flask_api","target":"sql","relationship":"uses","weight":0.78},
    {"source":"nodejs","target":"sql","relationship":"uses","weight":0.68},
    {"source":"rest_api","target":"react","relationship":"consumed_by","weight":0.76},
    {"source":"python","target":"machine_learning","relationship":"used_for","weight":0.88},
    {"source":"docker","target":"flask_api","relationship":"packages","weight":0.76},
    {"source":"docker","target":"nodejs","relationship":"packages","weight":0.76},
    {"source":"git","target":"github","relationship":"hosted_on","weight":1.0},
    {"source":"github","target":"docker","relationship":"automates","weight":0.56},
    {"source":"supabase","target":"rest_api","relationship":"exposes","weight":0.82}
  ]
}

